<!ELEMENT listapedidos (pedido*)>
<!ELEMENT pedido (codigo, cantidade, peso?)>
    <!ELEMENT codigo (#PCDATA)>
    <!ELEMENT cantidade (#PCDATA)>
    <!ELEMENT peso (#PCDATA)>